Story,Works with,No. of Actions,AuthorEnable secret scanning and push protection on newly public GitHub repositories,"['Elastic', 'GitHub']",4,Christopher Cutajar at Elastic
Raise incidents in Atlassian Statuspage,"['Slack', 'Statuspage']",16,
Get Cyberark Safes and Members,['CyberArk'],12,Nick Page
Create and sync Google Calendar events from Notion,"['Google Calendar', 'Notion']",23,Yanni Hajioannou
Sync Github file with a Tines Resource,"['GitHub', 'Tines']",13,Nick Page
Host your Teams contact details using Records and Pages,['GitHub'],11,Sif Baksh
Cisco Secure Endpoint weekly audit,['Cisco'],14,Tom Power at University of British Columbia
Onboard GitHub projects to SonarCloud and Airtable,"['Airtable', 'GitHub', 'SonarCloud']",36,Tyler Talaga
Query Spectra Intelligence for existing classification of inputted Hash,['Reversing Labs'],9,
Query Spectra Intelligence for URL reputation,['Reversing Labs'],16,
Update user in Tines,['Tines'],6,Michael Tolan
Monitor employees using Code42,['Code42'],8,
"Enrich CVE information using Microsoft, Recorded Future, CIRCL and GreyNoise","['GreyNoise', 'Microsoft', 'Recorded Future']",6,Michael Tolan
Sync IriusRisk projects with GitHub Terraform repositories,"['GitHub', 'IriusRisk', 'Slack']",21,Conor Dunne
